word,definition,origin,phonetic,sentence
aberration,"a deviation from what is normal or expected",Latin,/ˌæbəˈreɪʃən/,"The aberration in the data was caused by a faulty sensor."
belligerent,"hostile and aggressive",Latin,/bəˈlɪdʒərənt/,"The belligerent customer argued with the cashier over a small mistake."
camaraderie,"a feeling of trust and friendship among people who spend a lot of time together",French,/ˌkæməˈrɑːdəri/,"The camaraderie among the team members made the project enjoyable."
deference,"polite submission and respect",Latin,/ˈdɛfərəns/,"Out of deference to his elders, he always let them speak first."
ebullient,"cheerful and full of energy",Latin,/ɪˈbʌljənt/,"Her ebullient personality lit up the room at the party."
facetious,"treating serious issues with deliberately inappropriate humor",Latin,/fəˈsiːʃəs/,"His facetious remarks during the meeting annoyed the serious participants."
gregarious,"fond of company; sociable",Latin,/ɡrɪˈɡɛəriəs/,"The gregarious host invited everyone to join the conversation."
hierarchy,"a system in which members of an organization or society are ranked according to relative status or authority",Greek,/ˈhaɪəˌrɑːki/,"The company has a clear hierarchy from interns to executives."
iconoclast,"a person who attacks cherished beliefs or institutions",Greek,/aɪˈkɒnəklæst/,"The iconoclast writer challenged traditional literary norms."
juxtaposition,"the fact of two things being seen or placed close together with contrasting effect",Latin,/ˌdʒʌkstəpəˈzɪʃən/,"The juxtaposition of the old building next to the modern skyscraper was striking."
kaleidoscope,"a tube-shaped optical instrument that is rotated to produce a succession of symmetrical designs",Greek,/kəˈlaɪdəskəʊp/,"The kaleidoscope of colors in the sunset was mesmerizing."
labyrinth,"a complicated irregular network of passages or paths",Greek,/ˈlæbərɪnθ/,"The labyrinth of streets in the old city confused the tourists."
magnanimous,"generous or forgiving, especially towards a rival or less powerful person",Latin,/mæɡˈnænɪməs/,"The magnanimous leader forgave his opponent after the election."
nadir,"the lowest point in the fortunes of a person or organization",Latin,/ˈneɪdɪər/,"The company's stock reached its nadir during the recession."
obfuscate,"render obscure, unclear, or unintelligible",Latin,/ˈɒbfʌskeɪt/,"The politician tried to obfuscate the issue with complex jargon."
panacea,"a solution or remedy for all difficulties or diseases",Greek,/ˌpænəˈsiːə/,"There is no panacea for all the world's problems."
quintessential,"representing the most perfect or typical example of a quality or class",Latin,/ˌkwɪntɪˈsɛnʃəl/,"She is the quintessential professional, always prepared and efficient."
rhapsody,"an exalted expression of feeling",Latin,/ˈræpsədi/,"The musician played a rhapsody that moved the audience to tears."
sagacious,"having or showing keen mental discernment and good judgment",Latin,/səˈɡeɪʃəs/,"The sagacious advisor gave wise counsel to the king."
taciturn,"reserved or uncommunicative in speech; saying little",Latin,/ˈtæsɪtɜːrn/,"The taciturn librarian rarely spoke unless asked a question."
ubiquitous,"present, appearing, or found everywhere",Latin,/juːˈbɪkwɪtəs/,"Smartphones have become ubiquitous in modern society."
venerate,"regard with great respect",Latin,/ˈvɛnəreɪt/,"The community venerate their ancestors through annual ceremonies."
wanderlust,"a strong desire to travel",German,/ˈwɒndərlʌst/,"His wanderlust led him to explore every continent."